{
  "name": "K3 Labs",
  "category": [""],
  "criteria": {
    "slashing": {
      "is_implemented": false,
      "url": "https://docs.k3-labs.com/introduction/tech-documentation/operator-onboarding"
    },
    "reward": {
      "is_implemented": false,
      "url": "https://docs.k3-labs.com/introduction/tech-documentation/operator-onboarding"
    }
  },
  "contact": {
    "telegram": "",
    "discord": ""
  }
}
