{
  "name": "Omni Network",
  "category": ["Interoperability"],
  "criteria": {
    "slashing": {
      "is_implemented": false,
      "url": "https://docs.omni.network/introduction/whitepaper"
    },
    "reward": {
      "is_implemented": false,
      "url": "https://docs.omni.network/introduction/whitepaper"
    }
  },
  "contact": {
    "telegram": "",
    "discord": ""
  }
}
