{
  "name": "Opacity",
  "category": ["ZK", "Security"],
  "criteria": {
    "slashing": {
      "is_implemented": false,
      "url": "https://docs.opacity.network/"
    },
    "reward": {
      "is_implemented": false,
      "url": "https://docs.opacity.network/"
    }
  },
  "contact": {
    "telegram": "",
    "discord": ""
  }
}
