{
  "name": "Ungate",
  "category": [],
  "criteria": {
    "slashing": {
      "is_implemented": false,
      "url": "https://ungate.gitbook.io/ungate-wukong"
    },
    "reward": {
      "is_implemented": false,
      "url": "https://ungate.gitbook.io/ungate-wukong"
    }
  },
  "contact": {
    "telegram": "",
    "discord": ""
  }
}