{
  "name": "Openlayer",
  "category": ["Oracle"],
  "criteria": {
    "slashing": {
      "is_implemented": false,
      "url": "https://openlayer.gitbook.io/openlayer/openlayer-avs/how-openlayer-works"
    },
    "reward": {
      "is_implemented": false,
      "url": "https://openlayer.gitbook.io/openlayer/openlayer-avs/how-openlayer-works"
    }
  },
  "contact": {
    "telegram": "",
    "discord": ""
  }
}