{
  "name": "Automata",
  "category": ["Coprocessor"],
  "criteria": {
    "slashing": {
      "is_implemented": false,
      "url": "https://docs.ata.network/"
    },
    "reward": {
      "is_implemented": false,
      "url": "https://docs.ata.network/"
    }
  },
  "contact": {
    "telegram": "",
    "discord": ""
  }
}