{
  "name": "Cyber",
  "category": ["Social", "Rollup"],
  "criteria": {
    "slashing": {
      "is_implemented": false,
      "url": "https://docs.cyber.co/"
    },
    "reward": {
      "is_implemented": false,
      "url": "https://docs.cyber.co/"
    }
  },
  "contact": {
    "telegram": "",
    "discord": ""
  }
}