{
  "name": "Gasp",
  "category": [],
  "criteria": {
    "slashing": {
      "is_implemented": false,
      "url": "https://docs.gasp.xyz/"
    },
    "reward": {
      "is_implemented": false,
      "url": "https://docs.gasp.xyz/"
    }
  },
  "contact": {
    "telegram": "",
    "discord": ""
  }
}
