{
  "name": "Altlayer",
  "category": ["Rollup"],
  "criteria": {
    "slashing": {
      "is_implemented": true,
      "url": "https://docs.altlayer.io/altlayer-documentation/altlayer-facilitated-actively-validated-services/altlayer-mach-avs/operator-guide"
    },
    "reward": {
      "is_implemented": false,
      "url": "https://docs.altlayer.io/altlayer-documentation/altlayer-facilitated-actively-validated-services/altlayer-mach-avs/operator-guide"
    }
  },
  "contact": {
    "telegram": "",
    "discord": ""
  }
}