{
  "name": "Ava Protocol",
  "category": ["Intent", "Privacy"],
  "criteria": {
    "slashing": {
      "is_implemented": false,
      "url": "https://avaprotocol.org/docs/ethereum/getting-started/eigenlayer-avs"
    },
    "reward": {
      "is_implemented": false,
      "url": "https://avaprotocol.org/docs/ethereum/getting-started/eigenlayer-avs"
    }
  },
  "contact": {
    "telegram": "",
    "discord": ""
  }
}