{
  "name": "Silence Laboratories",
  "category": [],
  "criteria": {
    "slashing": {
      "is_implemented": false,
      "url": "https://docs.silencelaboratories.com/welcome"
    },
    "reward": {
      "is_implemented": false,
      "url": "https://docs.silencelaboratories.com/welcome"
    }
  },
  "contact": {
    "telegram": "",
    "discord": ""
  }
}
