{
  "name": "ETHGas",
  "category": [""],
  "criteria": {
    "slashing": {
      "is_implemented": true,
      "url": "https://docs.ethgas.com/actors-and-integrations/validators"
    },
    "reward": {
      "is_implemented": false,
      "url": "https://docs.ethgas.com/actors-and-integrations/validators"
    }
  },
  "contact": {
    "telegram": "",
    "discord": ""
  }
}