{
  "name": "WitnessChain",
  "category": ["Security"],
  "criteria": {
    "slashing": {
      "is_implemented": false,
      "url": "https://docs.witnesschain.com/infinity-watch/proof-of-location-mainnet/run-a-watchtower/eigenlayer-operators"
    },
    "reward": {
      "is_implemented": false,
      "url": "https://docs.witnesschain.com/infinity-watch/proof-of-location-mainnet/run-a-watchtower/eigenlayer-operators"
    }
  },
  "contact": {
    "telegram": "",
    "discord": ""
  }
}