{
  "name": "UniFi AVS",
  "category": ["Rollup"],
  "criteria": {
    "slashing": {
      "is_implemented": false,
      "url": "https://docs.puffer.fi/unifi-avs-intro"
    },
    "reward": {
      "is_implemented": false,
      "url": "https://docs.puffer.fi/unifi-avs-intro"
    }
  },
  "contact": {
    "telegram": "",
    "discord": ""
  }
}